{
  "schemaVersion": 1,
  "kind": "lesson",
  "id": "aula-recalque",
  "courseId": "curso-fundamentos",
  "moduleId": "modulo-conflito",
  "slug": "recalque-em-freud",
  "revision": 2,
  "status": "published",
  "title": "O recalque em Freud",
  "summary": "Entenda por que o recalque não é sinônimo de esquecer e como uma hipótese teórica exige investigação.",
  "estimatedMinutes": 18,
  "objectives": [
    "Diferenciar recalque de esquecimento cotidiano",
    "Examinar o limite de inferências feitas a partir de exemplos"
  ],
  "blocks": [
    {
      "id": "abertura-001",
      "type": "question",
      "version": 1,
      "data": {
        "prompt": "Esquecer alguma coisa é sempre recalcar?",
        "hint": "Antes de responder, pense na diferença entre uma descrição e uma hipótese."
      },
      "settings": {
        "isRequired": false
      }
    },
    {
      "id": "texto-001",
      "type": "rich_text",
      "version": 1,
      "data": {
        "title": "Um conceito, não uma tradução automática",
        "paragraphs": [
          "Na psicanálise freudiana, o recalque é um conceito relacionado ao conflito psíquico.",
          "Nem todo esquecimento permite concluir que um recalque ocorreu. A hipótese depende do contexto teórico e da investigação do caso."
        ]
      },
      "settings": {}
    },
    {
      "id": "conceito-001",
      "type": "concept",
      "version": 1,
      "data": {
        "term": "Recalque",
        "definition": "Na teoria freudiana, o recalque designa uma operação psíquica relacionada ao afastamento de certas representações da consciência, em condições de conflito.",
        "example": "Alguém não se lembrar de algo não basta, por si só, para demonstrar que o recalque esteja em jogo."
      },
      "settings": {
        "emphasis": "featured"
      }
    },
    {
      "id": "comparacao-001",
      "type": "comparison",
      "version": 1,
      "data": {
        "title": "Distinguir observação e hipótese",
        "caption": "Comparação didática de níveis de descrição e interpretação",
        "columns": [
          "O que é possível observar",
          "O que requer investigação"
        ],
        "rows": [
          {
            "criterion": "Relato",
            "values": [
              "A pessoa diz que não se recorda de um acontecimento.",
              "Que condições participam desse esquecimento?"
            ]
          },
          {
            "criterion": "Conceito",
            "values": [
              "A existência de uma lacuna na lembrança.",
              "A pertinência de formular uma hipótese de recalque."
            ]
          }
        ]
      },
      "settings": {}
    },
    {
      "id": "caso-001",
      "type": "clinical_vignette",
      "version": 1,
      "data": {
        "title": "Um exemplo fictício",
        "narrative": "Um personagem relata que não se recorda de uma conversa importante e se pergunta por quê.",
        "reflection": "Que outras explicações e perguntas deveriam ser consideradas antes de concluir que existe recalque?",
        "disclaimer": "Esta vinheta é inteiramente fictícia e não constitui diagnóstico."
      },
      "settings": {}
    },
    {
      "id": "percurso-1915",
      "type": "timeline",
      "version": 1,
      "data": {
        "title": "Do problema clínico à elaboração teórica",
        "events": [
          {
            "date": "1895",
            "title": "Estudos sobre a histeria",
            "description": "Freud e Breuer investigam experiências clínicas que alimentariam novas perguntas sobre os sintomas."
          },
          {
            "date": "1915",
            "title": "O recalque",
            "description": "Freud publica um ensaio dedicado à formulação metapsicológica do conceito."
          }
        ]
      },
      "settings": {
        "showInOutline": true
      }
    },
    {
      "id": "nota-editorial-001",
      "type": "quote",
      "version": 1,
      "data": {
        "title": "Um cuidado de leitura",
        "text": "Um fenômeno relatado não fornece, sozinho, sua interpretação.",
        "attribution": "Atelier — síntese didática, não citação de Freud"
      },
      "settings": {}
    },
    {
      "id": "quiz-001",
      "type": "multiple_choice",
      "version": 1,
      "data": {
        "prompt": "Qual formulação evita reduzir o recalque a qualquer esquecimento?",
        "options": [
          {
            "id": "a",
            "text": "Todo esquecimento é necessariamente um recalque."
          },
          {
            "id": "b",
            "text": "O recalque é uma hipótese teórica que não pode ser presumida de qualquer esquecimento."
          },
          {
            "id": "c",
            "text": "A memória consciente fornece acesso completo às causas do conflito."
          }
        ],
        "correctOptionId": "b",
        "feedbackCorrect": "Correto: a distinção conceitual exige contexto e não permite inferência automática.",
        "feedbackIncorrect": "Releia a diferença entre o fenômeno observado e a interpretação teórica."
      },
      "settings": {
        "attempts": "unlimited",
        "isRequired": false
      }
    },
    {
      "id": "referencias-001",
      "type": "references",
      "version": 1,
      "data": {
        "referenceIds": [
          "ref-freud-recalque"
        ]
      },
      "settings": {}
    }
  ],
  "references": [
    {
      "id": "ref-freud-recalque",
      "author": "Freud, Sigmund",
      "title": "O recalque (Die Verdrängung)",
      "year": 1915,
      "note": "Consultar a edição/tradução efetivamente utilizada antes de publicar uma aula definitiva."
    }
  ],
  "metadata": {
    "demo": true,
    "readingLevel": "introducao",
    "tags": [
      "freud",
      "recalque",
      "defesa"
    ]
  }
}
